{
  "$schema": "../../../schemas/memory.schema.json",

  "id": "memory.newsroom",

  "type": "working",

  "scope": "workflow",

  "name": "News Production Memory",

  "description": "Working memory used throughout the News Production composition to maintain editorial context, intermediate outputs, and publication state.",

  "status": "active",

  "metadata": {
    "name": "News Production Memory",
    "description": "Stores newsroom execution context and generated editorial artifacts.",
    "version": "1.0.0",
    "tags": [
      "memory",
      "working",
      "news",
      "editorial",
      "example"
    ]
  },

  "content": {
    "headline": "",
    "summary": "",
    "category": "general",
    "language": "en",

    "sources": [],

    "facts": [],

    "draft": "",

    "factCheck": {
      "verified": [],
      "unverified": [],
      "confidence": 0.0
    },

    "editorReview": {
      "approved": false,
      "comments": []
    },

    "seo": {
      "title": "",
      "description": "",
      "keywords": []
    },

    "featuredImage": "",

    "finalArticle": "",

    "publication": {
      "status": "draft",
      "scheduledAt": null
    }
  },

  "embedding": [],

  "provider": {
    "id": "provider.openai",
    "name": "openai",
    "type": "openai"
  },

  "index": "newsroom-memory",

  "namespace": "examples.news-production",

  "ttl": 604800,

  "owner": {
    "id": "workflow.news-production",
    "type": "workflow",
    "name": "News Production Workflow"
  },

  "references": [
    {
      "id": "composition.news-production",
      "type": "composition"
    },
    {
      "id": "workflow.news-production",
      "type": "workflow"
    }
  ],

  "createdAt": "2026-01-01T00:00:00Z",

  "updatedAt": "2026-01-01T00:00:00Z",

  "expiresAt": "2026-01-08T00:00:00Z",

  "tags": [
    "working-memory",
    "newsroom",
    "editorial",
    "example"
  ],

  "labels": {
    "environment": "development",
    "retention": "7d",
    "domain": "news"
  }
}